{
  "schemaVersion": "makers-anvil.status.current.v1",
  "claimState": "staged",
  "product": {
    "name": "Makers Anvil",
    "repository": "https://github.com/TreadSoftly/MakersAnvil",
    "sourceRoot": "."
  },
  "currentPass": {
    "id": "PASS-024",
    "title": "verified app-owned raster previews in the promoted workbench",
    "claimState": "staged",
    "reportPath": "docs/passes/PASS_024_REPORT.md"
  },
  "trackPercentages": {
    "realApp": 82.5,
    "windowsLocal": 86.0,
    "macLinux": 0.0,
    "webHosted": 0.0,
    "packagedRelease": 30.0,
    "cleanMachineProof": 5.0
  },
  "sourceTruth": {
    "statusPath": "state/current_status.json",
    "passLedgerPath": "state/pass_ledger.json",
    "buildStatusPath": "docs/BUILD_STATUS.md",
    "continueProtocolPath": "docs/CONTINUE_PROTOCOL.md",
    "sourceWalkthroughPath": "docs/SOURCE_WALKTHROUGH.md",
    "referenceStudyPath": "docs/PREVIOUS_APP_REFERENCE_STUDY.md",
    "lineByLineGuidePath": "docs/LINE_BY_LINE_CODE_GUIDE.md",
    "learningCoveragePath": "state/learning_coverage.json",
    "desktopArchitecturePath": "docs/DESKTOP_ARCHITECTURE.md",
    "previousAppMergerAuditPath": "docs/PREVIOUS_APP_MERGER_AUDIT.md",
    "previousAppMigrationPath": "state/previous_app_migration.json",
    "intakePolicyPath": "config/intake_policy.json",
    "intakePreviewPolicyPath": "config/intake_preview_policy.json",
    "intakeAuthorizationSchemaPath": "schemas/intake-authorization.schema.json",
    "authorizedIntakeRecordSchemaPath": "schemas/authorized-intake-record.schema.json",
    "intakePreviewPolicySchemaPath": "schemas/intake-preview-policy.schema.json",
    "workbenchExperiencePolicyPath": "config/workbench_experience.json",
    "capabilityMatrixSchemaPath": "schemas/capability-matrix.schema.json",
    "activityHistorySchemaPath": "schemas/activity-history.schema.json",
    "containedExecutionPolicyPath": "config/contained_execution_policy.json",
    "containedExecutionRecordSchemaPath": "schemas/contained-execution-record.schema.json",
    "executionProofSchemaPath": "schemas/execution-proof.schema.json",
    "lifecycleDryRunPolicyPath": "config/lifecycle_dry_run_policy.json",
    "lifecycleDryRunCatalogSchemaPath": "schemas/lifecycle-dry-run-catalog.schema.json"
    ,"windowsInstallerPolicyPath": "config/windows_installer_policy.json"
    ,"cleanMachineScenariosPath": "config/clean_machine_scenarios.json"
    ,"windowsInstallerReadinessSchemaPath": "schemas/windows-installer-readiness.schema.json"
    ,"cleanMachineHarnessSchemaPath": "schemas/clean-machine-harness.schema.json"
  },
  "referencePolicy": {
    "folder": "Refrences For Makers Anvil Application",
    "runtimeDependency": false,
    "gitTracked": false,
    "purpose": "reference-only"
  },
  "proven": [
    "Read-only local API exposes health, durable status, workspace, intake, route, output, tool, gate, and execution-request preview records.",
    "Durable status files are committed product source and parse as JSON.",
    "Browser dashboard renders current pass and source-truth paths from the API.",
    "Default local settings define an app-owned runtime data directory without importing user files.",
    "Metadata-only intake records omit source paths and contents and do not copy, move, delete, extract, execute, or launch source files.",
    "Runtime data resolves through OS user-data conventions or an explicit absolute override and never depends on the source checkout path.",
    "API and dashboard records expose logical location metadata instead of resolved personal filesystem paths.",
    "Every tracked source file has a machine-readable purpose and maintenance record.",
    "Every Python component, every top-level frontend function, and frontend/workflow file headers are protected by an explainability verifier.",
    "A durable start guide, implementation guide, learning-resource map, pass-report template, architecture guide, file map, and code-explanation standard let a new human or model resume from repository truth.",
    "Validated intake metadata maps deterministically to read-only route previews with planned steps and explicit blockers.",
    "Route previews do not use source paths, read contents, open files, extract archives, execute routes, launch tools, or create outputs.",
    "The dashboard renders route-preview status and candidates without treating preview state as execution readiness.",
    "Route previews map to planned output bundles, expected artifacts, logical destinations, and required proof checklists.",
    "Every output artifact remains planned and nonexistent, every proof item remains not proven, and create/open actions remain blocked.",
    "Output planning exposes only logical app-owned locations and never creates directories, writes files, captures proof, or opens outputs.",
    "Known maker tools are checked through PATH and narrowly scoped standard locations without executing processes or reading the registry.",
    "Tool detection results expose tool identity, family, method, and executable name while withholding resolved installation paths.",
    "Missing matches remain not proven, versions remain not proven, and launch/install/update/uninstall/repair actions remain blocked.",
    "Route previews, output plans, and detected tool families compose into semantic tool dry-run plans.",
    "Dry-run plans use logical source and destination references, select only family-compatible detected tools, and expose no resolved paths.",
    "Dry-run planning constructs no command string, performs no file handoff, launches no process, writes nothing, and remains execution-blocked.",
    "Execution gate policy allowlists only mesh-to-toolpath, reserves one future concurrency slot, and keeps execution disabled.",
    "Gate evaluation distinguishes proven planning evidence from unproven authorization, containment, compatibility, cancellation, logging, and proof requirements.",
    "No execution request is created, no authorization is accepted, no path or command is resolved, and no process or execution-side record is produced.",
    "Read-only request previews compose deterministic logical intent from coherent dry-run plans and gate evaluations for mesh-to-toolpath only.",
    "Request previews require explicit authorization but keep acceptance false, actor and timestamp absent, and request persistence disabled.",
    "The complete append-only audit lifecycle is declared while its event list remains empty and audit writes remain disabled.",
    "The dashboard renders request, authorization, audit, and execution-blocked truth without any action control.",
    "An explicit local script can prepare one deterministic app-owned job workspace from a valid mesh-to-toolpath request preview.",
    "Prepared jobs store only logical intent, create empty control, working, logs, and output directories, and accept no authorization.",
    "A second explicit local script records cancellation intent idempotently without signaling or claiming that a process stopped.",
    "Read-only job policy and catalog APIs expose path-redacted prepared and cancellation state while every HTTP mutation remains blocked.",
    "Malformed, weakened, traversing, or symlinked job records fail closed and are never exposed as usable jobs.",
    "The earlier working Makers Anvil prototype has a tracked design study that preserves accepted layout, workflow, wording, visual, and responsive lessons without becoming a runtime dependency.",
    "Every comment-capable source file begins with visible structured context covering purpose, caller, inputs, outputs, side effects, safety, failure behavior, and related proof.",
    "A file-by-file source walkthrough connects backend, frontend, scripts, structured contracts, tests, and durable truth for future humans and models.",
    "The explainability checker rejects missing structured source context and undersized component documentation.",
    "The first screen is a bounded preview-first maker workbench instead of a long equal-weight status stack.",
    "Persistent rail navigation, quick-jump search, and stable Work Flow, Plans, and Dev tabs change browser views without mutating application state.",
    "Source intake truth, selected-input metadata, tool inventory, work plans, job workspaces, expected output, and latest proof have dedicated synchronized work zones.",
    "Desktop workbench layout fits 1366x768 and 1280x720 without page overflow; narrow screens reflow without horizontal overflow.",
    "Browser upload and every operational command remain visibly blocked while read-only planning evidence stays available.",
    "Every Python class, constructor, function, method, helper, and test carries all nine required teaching fields.",
    "Every top-level JavaScript function and every CSS or semantic HTML block carries locally visible teaching documentation.",
    "A generated line-numbered guide explains every physical implementation and structured-contract line, including comment-free JSON.",
    "Exact source hashes and line totals make stale or incomplete learning coverage fail verification.",
    "The previous working app is inventoried as migration evidence with explicit adopt, migrate, rebuild, and reject decisions instead of becoming a second runtime.",
    "A local generated guide explains all 14,611 physical lines across 29 selected first-party previous-app files while excluding dependencies and generated data.",
    "Native desktop mode owns one ephemeral loopback server and one secured pywebview window over the same current frontend and API.",
    "Closing the native window deterministically shuts down its owned server; remote binds, downloads, file URLs, direct JavaScript bridging, devtools, and remote debugging remain disabled.",
    "A deterministic Windows PyInstaller plan bundles the frontend and Python core into MakersAnvil.exe without a source-checkout path dependency.",